### ISSUE TITLE
Jetty HTTP ERROR: 500 with a GET parameter and subsequent requests

### ISSUE THREAD

**Issue by Joe-Klauza** [tomakehurst/wiremock#620]
I've been checking out [Couchbase](https://www.couchbase.com/)'s REST API and would like to record and replay some interactions using WireMock. Unfortunately I've encountered an issue where a GET request with a parameter being made multiple times (immediately following the previous) causes Jetty to return a 500 error.

This is the URL I'm `GET`ting, proxied to couchbase via WireMock: `http://localhost:8442/pools/default?waitChange=0`

I'm mostly using the [Insomnia](https://insomnia.rest/) REST client to send the request. I've determined that the following do not affect the result:
- HTTP request headers
- HTTP request auth
- REST client
- `--container-threads` amount
- `--jetty-acceptor-threads` amount
- `--jetty-accept-queue-size` amount

In my tests I've found that removing the parameter `?waitChange=0` does not reproduce the issue (multiple, subsequent requests can be made as quickly as possible with a valid response). I've also found that trying a test parameter (`?test=0`) does not reproduce the issue.

The reason I think WireMock is the culprit (as opposed to Couchbase's REST implementation) is that I can make the same requests directly to Couchbase and get a successful response every time.

Here are the logs and the startup command used to run the server; the problem URI was hit twice for this test, with the second attempt failing:
```
java -jar /path/to/wiremock-standalone-2.5.1.jar --container-threads 200 --print-all-network-traffic --verbose --https-port 8443 --port 8442 --root-dir /path/to/wiremock-recordings/test-record --proxy-all="http://<my-couchbase-host>:8091" --record-mappings --match-headers="Accept,Content-Type,Cache-Control,Authorization"

2017-03-02 11:11:30.149 Verbose logging enabled
SLF4J: Failed to load class "org.slf4j.impl.StaticLoggerBinder".
SLF4J: Defaulting to no-operation (NOP) logger implementation
SLF4J: See http://www.slf4j.org/codes.html#StaticLoggerBinder for further details.
2017-03-02 11:11:30.455 Verbose logging enabled
2017-03-02 11:11:30.473 Verbose logging enabled
2017-03-02 11:11:30.512 Recording mappings to /path/to/wiremock-recordings/test-record/mappings
 /$$      /$$ /$$                     /$$      /$$                     /$$
| $$  /$ | $$|__/                    | $$$    /$$$                    | $$
| $$ /$$$| $$ /$$  /$$$$$$   /$$$$$$ | $$$$  /$$$$  /$$$$$$   /$$$$$$$| $$   /$$
| $$/$$ $$ $$| $$ /$$__  $$ /$$__  $$| $$ $$/$$ $$ /$$__  $$ /$$_____/| $$  /$$/
| $$$$_  $$$$| $$| $$  \__/| $$$$$$$$| $$  $$$| $$| $$  \ $$| $$      | $$$$$$/
| $$$/ \  $$$| $$| $$      | $$_____/| $$\  $ | $$| $$  | $$| $$      | $$_  $$
| $$/   \  $$| $$| $$      |  $$$$$$$| $$ \/  | $$|  $$$$$$/|  $$$$$$$| $$ \  $$
|__/     \__/|__/|__/       \_______/|__/     |__/ \______/  \_______/|__/  \__/

port:                         8442
https-port:                   8443
https-keystore:               jar:file:/path/to/wiremock-standalone-2.5.1.jar!/keystore
proxy-all:                    http://<my-couchbase-host>:8091
preserve-host-header:         false
enable-browser-proxying:      false
record-mappings:              true
match-headers:                [Accept, Content-Type, Cache-Control, Authorization]
no-request-journal:           false
verbose:                      true

2017-03-02 11:11:50.615 Opened Socket[addr=/127.0.0.1,port=60484,localport=8442]
2017-03-02 11:11:50.646 Incoming bytes: GET /pools/default?waitChange=0 HTTP/1.1
Authorization: Basic cm91c2VyOnBhc3N3b3Jk
Accept: */*
User-Agent: insomnia/4.2.14
host: localhost:8442
accept-encoding: gzip, deflate
Connection: keep-alive


2017-03-02 11:11:50.694 Proxying: GET http://<my-couchbase-host>:8091/pools/default?waitChange=0
2017-03-02 11:11:51.001 Request received:
127.0.0.1 - GET /pools/default?waitChange=0

Accept-Encoding: [gzip, deflate]
User-Agent: [insomnia/4.2.14]
Authorization: [Basic cm91c2VyOnBhc3N3b3Jk]
Connection: [keep-alive]
Host: [localhost:8442]
Accept: [*/*]



Matched response definition:
{
  "status" : 200,
  "proxyBaseUrl" : "http://<my-couchbase-host>:8091"
}

Response:
HTTP/1.1 200
Server: [Couchbase Server]
Pragma: [no-cache]
Date: [Thu, 02 Mar 2017 16:11:57 GMT]
Content-Type: [application/json]
Content-Length: [5860]
Cache-Control: [no-cache]

{"etag":"95119255","clusterName":"","storageTotals":{"ram":{"total":12289662976,"quotaTotal":6442450944,"quotaUsed":6442450944,"used":6740443136,"usedByData":611960684,"quotaUsedPerNode":2147483648,"quotaTotalPerNode":2147483648},"hdd":{"total":222675869696,"quotaTotal":222675869696,"used":2226758696,"usedByData":472303039,"free":0}},"balanced":true,"failoverWarnings":[],"goxdcrEnabled":true,"ldapEnabled":false,"serverGroupsUri":"/pools/default/serverGroups?v=108506564","indexMemoryQuota":256,"memoryQuota":2048,"name":"default","alerts":[],"alertsSilenceURL":"/controller/resetAlerts?token=0&uuid=8e989e84e055a831e614fc877e41a325","nodes":[{"systemStats":{"cpu_utilization_rate":4.556962025316456,"swap_total":6442446848,"swap_used":11964416,"mem_total":3975221248,"mem_free":2175139840},"interestingStats":{"cmd_get":0,"couch_docs_actual_disk_size":151499227,"couch_docs_data_size":122352976,"couch_spatial_data_size":5963158,"couch_spatial_disk_size":5974801,"couch_views_actual_disk_size":6020437,"couch_views_data_size":45636,"curr_items":18085,"curr_items_tot":40985,"ep_bg_fetched":0,"get_hits":0,"mem_used":211950032,"ops":0,"vb_replica_curr_items":22900},"uptime":"1375990","memoryTotal":3975221248,"memoryFree":2175139840,"mcdMemoryReserved":3032,"mcdMemoryAllocated":3032,"couchApiBase":"http://10.77.15.9:8092/","clusterMembership":"active","recoveryType":"none","status":"healthy","otpNode":"ns_1@10.77.15.9","hostname":"10.77.15.9:8091","clusterCompatibility":262145,"version":"4.1.1-5914-community","os":"x86_64-unknown-linux-gnu","ports":{"proxy":11211,"direct":11210},"services":["kv"]},{"systemStats":{"cpu_utilization_rate":8.860759493670885,"swap_total":6442446848,"swap_used":91934720,"mem_total":4019945472,"mem_free":2099113984},"interestingStats":{"cmd_get":0,"couch_docs_actual_disk_size":146480622,"couch_docs_data_size":115802791,"couch_spatial_data_size":6016449,"couch_spatial_disk_size":6028080,"couch_views_actual_disk_size":6073704,"couch_views_data_size":45624,"curr_items":17971,"curr_items_tot":40872,"ep_bg_fetched":0,"get_hits":0,"mem_used":211841656,"ops":0,"vb_replica_curr_items":22901},"uptime":"1375466","memoryTotal":4019945472,"memoryFree":2099113984,"mcdMemoryReserved":3066,"mcdMemoryAllocated":3066,"couchApiBase":"http://<my-couchbase-host>:8092/","clusterMembership":"active","recoveryType":"none","status":"healthy","otpNode":"ns_1@<my-couchbase-host>","thisNode":true,"hostname":"<my-couchbase-host>:8091","clusterCompatibility":262145,"version":"4.1.1-5914-community","os":"x86_64-unknown-linux-gnu","ports":{"proxy":11211,"direct":11210},"services":["index","kv","n1ql"]},{"systemStats":{"cpu_utilization_rate":7.770859277708593,"swap_total":5032693760,"swap_used":2974310400,"mem_total":4294496256,"mem_free":1784737792},"interestingStats":{"cmd_get":0,"couch_docs_actual_disk_size":138140830,"couch_docs_data_size":107413823,"couch_spatial_data_size":6007194,"couch_spatial_disk_size":6019831,"couch_views_actual_disk_size":6065507,"couch_views_data_size":45676,"curr_items":18010,"curr_items_tot":40877,"ep_bg_fetched":0,"get_hits":0,"mem_used":188168996,"ops":0,"vb_replica_curr_items":22869},"uptime":"1375673","memoryTotal":4294496256,"memoryFree":1784737792,"mcdMemoryReserved":3276,"mcdMemoryAllocated":3276,"couchApiBase":"http://<another-couchbase-host>:8092/","clusterMembership":"active","recoveryType":"none","status":"healthy","otpNode":"ns_1@<another-couchbase-host>","hostname":"<another-couchbase-host>:8091","clusterCompatibility":262145,"version":"4.1.1-5914-community","os":"win64","ports":{"proxy":11211,"direct":11210},"services":["index","kv","n1ql"]}],"buckets":{"uri":"/pools/default/buckets?v=80956094&uuid=8e989e84e055a831e614fc877e41a325","terseBucketsBase":"/pools/default/b/","terseStreamingBucketsBase":"/pools/default/bs/"},"remoteClusters":{"uri":"/pools/default/remoteClusters?uuid=8e989e84e055a831e614fc877e41a325","validateURI":"/pools/default/remoteClusters?just_validate=1"},"controllers":{"addNode":{"uri":"/controller/addNodeV2?uuid=8e989e84e055a831e614fc877e41a325"},"rebalance":{"uri":"/controller/rebalance?uuid=8e989e84e055a831e614fc877e41a325"},"failOver":{"uri":"/controller/failOver?uuid=8e989e84e055a831e614fc877e41a325"},"startGracefulFailover":{"uri":"/controller/startGracefulFailover?uuid=8e989e84e055a831e614fc877e41a325"},"reAddNode":{"uri":"/controller/reAddNode?uuid=8e989e84e055a831e614fc877e41a325"},"reFailOver":{"uri":"/controller/reFailOver?uuid=8e989e84e055a831e614fc877e41a325"},"ejectNode":{"uri":"/controller/ejectNode?uuid=8e989e84e055a831e614fc877e41a325"},"setRecoveryType":{"uri":"/controller/setRecoveryType?uuid=8e989e84e055a831e614fc877e41a325"},"setAutoCompaction":{"uri":"/controller/setAutoCompaction?uuid=8e989e84e055a831e614fc877e41a325","validateURI":"/controller/setAutoCompaction?just_validate=1"},"clusterLogsCollection":{"startURI":"/controller/startLogsCollection?uuid=8e989e84e055a831e614fc877e41a325","cancelURI":"/controller/cancelLogsCollection?uuid=8e989e84e055a831e614fc877e41a325"},"replication":{"createURI":"/controller/createReplication?uuid=8e989e84e055a831e614fc877e41a325","validateURI":"/controller/createReplication?just_validate=1"}},"rebalanceStatus":"none","rebalanceProgressUri":"/pools/default/rebalanceProgress","stopRebalanceUri":"/controller/stopRebalance?uuid=8e989e84e055a831e614fc877e41a325","nodeStatusesUri":"/nodeStatuses","maxBucketCount":10,"autoCompactionSettings":{"parallelDBAndViewCompaction":false,"databaseFragmentationThreshold":{"percentage":30,"size":"undefined"},"viewFragmentationThreshold":{"percentage":30,"size":"undefined"},"indexFragmentationThreshold":{"percentage":30}},"tasks":{"uri":"/pools/default/tasks?v=81654723"},"counters":{"rebalance_success":1,"rebalance_start":1},"indexStatusURI":"/indexStatus?v=101727310"}

2017-03-02 11:11:51.005 Recording mappings for /pools/default?waitChange=0
2017-03-02 11:11:51.038 Outgoing bytes: HTTP/1.1 200 OK
Server: Couchbase Server
Pragma: no-cache
Date: Thu, 02 Mar 2017 16:11:57 GMT
Content-Type: application/json
Cache-Control: no-cache
Content-Encoding: gzip
Vary: Accept-Encoding, User-Agent
Transfer-Encoding: chunked

A

2017-03-02 11:11:51.038 Problem decoding network traffic
java.nio.charset.MalformedInputException: Input length = 1
    at java.nio.charset.CoderResult.throwException(CoderResult.java:277)
    at java.nio.charset.CharsetDecoder.decode(CharsetDecoder.java:798)
    at com.github.tomakehurst.wiremock.http.trafficlistener.ConsoleNotifyingWiremockNetworkTrafficListener.outgoing(ConsoleNotifyingWiremockNetworkTrafficListener.java:34)
    at com.github.tomakehurst.wiremock.jetty9.JettyHttpServer$NetworkTrafficListenerAdapter.outgoing(JettyHttpServer.java:369)
    at wiremock.org.eclipse.jetty.io.NetworkTrafficSelectChannelEndPoint.notifyOutgoing(NetworkTrafficSelectChannelEndPoint.java:144)
    at wiremock.org.eclipse.jetty.io.NetworkTrafficSelectChannelEndPoint.flush(NetworkTrafficSelectChannelEndPoint.java:65)
    at wiremock.org.eclipse.jetty.io.WriteFlusher.flush(WriteFlusher.java:408)
    at wiremock.org.eclipse.jetty.io.WriteFlusher.write(WriteFlusher.java:302)
    at wiremock.org.eclipse.jetty.io.AbstractEndPoint.write(AbstractEndPoint.java:129)
    at wiremock.org.eclipse.jetty.server.HttpConnection$SendCallback.process(HttpConnection.java:676)
    at wiremock.org.eclipse.jetty.util.IteratingCallback.processing(IteratingCallback.java:246)
    at wiremock.org.eclipse.jetty.util.IteratingCallback.iterate(IteratingCallback.java:208)
    at wiremock.org.eclipse.jetty.server.HttpConnection.send(HttpConnection.java:471)
    at wiremock.org.eclipse.jetty.server.HttpChannel.sendResponse(HttpChannel.java:763)
    at wiremock.org.eclipse.jetty.server.HttpChannel.write(HttpChannel.java:801)
    at wiremock.org.eclipse.jetty.server.HttpOutput.write(HttpOutput.java:147)
    at wiremock.org.eclipse.jetty.server.HttpOutput.write(HttpOutput.java:140)
    at wiremock.org.eclipse.jetty.server.HttpOutput.flush(HttpOutput.java:242)
    at java.io.FilterOutputStream.flush(FilterOutputStream.java:140)
    at wiremock.org.eclipse.jetty.servlets.gzip.AbstractCompressedStream.flush(AbstractCompressedStream.java:125)
    at com.github.tomakehurst.wiremock.servlet.WireMockHandlerDispatchingServlet.writeAndTranslateExceptions(WireMockHandlerDispatchingServlet.java:165)
    at com.github.tomakehurst.wiremock.servlet.WireMockHandlerDispatchingServlet.applyResponse(WireMockHandlerDispatchingServlet.java:154)
    at com.github.tomakehurst.wiremock.servlet.WireMockHandlerDispatchingServlet$ServletHttpResponder.respond(WireMockHandlerDispatchingServlet.java:121)
    at com.github.tomakehurst.wiremock.http.AbstractRequestHandler.handle(AbstractRequestHandler.java:63)
    at com.github.tomakehurst.wiremock.servlet.WireMockHandlerDispatchingServlet.service(WireMockHandlerDispatchingServlet.java:100)
    at javax.servlet.http.HttpServlet.service(HttpServlet.java:790)
    at wiremock.org.eclipse.jetty.servlet.ServletHolder.handle(ServletHolder.java:808)
    at wiremock.org.eclipse.jetty.servlet.ServletHandler$CachedChain.doFilter(ServletHandler.java:1669)
    at wiremock.org.eclipse.jetty.servlets.UserAgentFilter.doFilter(UserAgentFilter.java:83)
    at wiremock.org.eclipse.jetty.servlets.GzipFilter.doFilter(GzipFilter.java:364)
    at wiremock.org.eclipse.jetty.servlet.ServletHandler$CachedChain.doFilter(ServletHandler.java:1652)
    at wiremock.org.eclipse.jetty.servlet.ServletHandler.doHandle(ServletHandler.java:585)
    at wiremock.org.eclipse.jetty.server.handler.ContextHandler.doHandle(ContextHandler.java:1127)
    at wiremock.org.eclipse.jetty.servlet.ServletHandler.doScope(ServletHandler.java:515)
    at wiremock.org.eclipse.jetty.server.handler.ContextHandler.doScope(ContextHandler.java:1061)
    at wiremock.org.eclipse.jetty.server.handler.ScopedHandler.handle(ScopedHandler.java:141)
    at wiremock.org.eclipse.jetty.server.handler.HandlerCollection.handle(HandlerCollection.java:110)
    at wiremock.org.eclipse.jetty.server.handler.HandlerWrapper.handle(HandlerWrapper.java:97)
    at wiremock.org.eclipse.jetty.server.Server.handle(Server.java:499)
    at wiremock.org.eclipse.jetty.server.HttpChannel.handle(HttpChannel.java:310)
    at wiremock.org.eclipse.jetty.server.HttpConnection.onFillable(HttpConnection.java:257)
    at wiremock.org.eclipse.jetty.io.AbstractConnection$2.run(AbstractConnection.java:540)
    at wiremock.org.eclipse.jetty.util.thread.QueuedThreadPool.runJob(QueuedThreadPool.java:635)
    at wiremock.org.eclipse.jetty.util.thread.QueuedThreadPool$3.run(QueuedThreadPool.java:555)
    at java.lang.Thread.run(Thread.java:745)
2017-03-02 11:11:51.043 Outgoing bytes:
686

2017-03-02 11:11:51.044 Problem decoding network traffic
java.nio.charset.MalformedInputException: Input length = 1
    at java.nio.charset.CoderResult.throwException(CoderResult.java:277)
    at java.nio.charset.CharsetDecoder.decode(CharsetDecoder.java:798)
    at com.github.tomakehurst.wiremock.http.trafficlistener.ConsoleNotifyingWiremockNetworkTrafficListener.outgoing(ConsoleNotifyingWiremockNetworkTrafficListener.java:34)
    at com.github.tomakehurst.wiremock.jetty9.JettyHttpServer$NetworkTrafficListenerAdapter.outgoing(JettyHttpServer.java:369)
    at wiremock.org.eclipse.jetty.io.NetworkTrafficSelectChannelEndPoint.notifyOutgoing(NetworkTrafficSelectChannelEndPoint.java:144)
    at wiremock.org.eclipse.jetty.io.NetworkTrafficSelectChannelEndPoint.flush(NetworkTrafficSelectChannelEndPoint.java:65)
    at wiremock.org.eclipse.jetty.io.WriteFlusher.flush(WriteFlusher.java:408)
    at wiremock.org.eclipse.jetty.io.WriteFlusher.write(WriteFlusher.java:302)
    at wiremock.org.eclipse.jetty.io.AbstractEndPoint.write(AbstractEndPoint.java:129)
    at wiremock.org.eclipse.jetty.server.HttpConnection$SendCallback.process(HttpConnection.java:684)
    at wiremock.org.eclipse.jetty.util.IteratingCallback.processing(IteratingCallback.java:246)
    at wiremock.org.eclipse.jetty.util.IteratingCallback.iterate(IteratingCallback.java:208)
    at wiremock.org.eclipse.jetty.server.HttpConnection.send(HttpConnection.java:480)
    at wiremock.org.eclipse.jetty.server.HttpChannel.sendResponse(HttpChannel.java:768)
    at wiremock.org.eclipse.jetty.server.HttpChannel.write(HttpChannel.java:801)
    at wiremock.org.eclipse.jetty.server.HttpOutput.write(HttpOutput.java:147)
    at wiremock.org.eclipse.jetty.server.HttpOutput.write(HttpOutput.java:140)
    at wiremock.org.eclipse.jetty.server.HttpOutput.close(HttpOutput.java:171)
    at wiremock.org.eclipse.jetty.servlets.gzip.DeflatedOutputStream.close(DeflatedOutputStream.java:96)
    at wiremock.org.eclipse.jetty.servlets.gzip.AbstractCompressedStream.close(AbstractCompressedStream.java:162)
    at com.github.tomakehurst.wiremock.servlet.WireMockHandlerDispatchingServlet.writeAndTranslateExceptions(WireMockHandlerDispatchingServlet.java:166)
    at com.github.tomakehurst.wiremock.servlet.WireMockHandlerDispatchingServlet.applyResponse(WireMockHandlerDispatchingServlet.java:154)
    at com.github.tomakehurst.wiremock.servlet.WireMockHandlerDispatchingServlet$ServletHttpResponder.respond(WireMockHandlerDispatchingServlet.java:121)
    at com.github.tomakehurst.wiremock.http.AbstractRequestHandler.handle(AbstractRequestHandler.java:63)
    at com.github.tomakehurst.wiremock.servlet.WireMockHandlerDispatchingServlet.service(WireMockHandlerDispatchingServlet.java:100)
    at javax.servlet.http.HttpServlet.service(HttpServlet.java:790)
    at wiremock.org.eclipse.jetty.servlet.ServletHolder.handle(ServletHolder.java:808)
    at wiremock.org.eclipse.jetty.servlet.ServletHandler$CachedChain.doFilter(ServletHandler.java:1669)
    at wiremock.org.eclipse.jetty.servlets.UserAgentFilter.doFilter(UserAgentFilter.java:83)
    at wiremock.org.eclipse.jetty.servlets.GzipFilter.doFilter(GzipFilter.java:364)
    at wiremock.org.eclipse.jetty.servlet.ServletHandler$CachedChain.doFilter(ServletHandler.java:1652)
    at wiremock.org.eclipse.jetty.servlet.ServletHandler.doHandle(ServletHandler.java:585)
    at wiremock.org.eclipse.jetty.server.handler.ContextHandler.doHandle(ContextHandler.java:1127)
    at wiremock.org.eclipse.jetty.servlet.ServletHandler.doScope(ServletHandler.java:515)
    at wiremock.org.eclipse.jetty.server.handler.ContextHandler.doScope(ContextHandler.java:1061)
    at wiremock.org.eclipse.jetty.server.handler.ScopedHandler.handle(ScopedHandler.java:141)
    at wiremock.org.eclipse.jetty.server.handler.HandlerCollection.handle(HandlerCollection.java:110)
    at wiremock.org.eclipse.jetty.server.handler.HandlerWrapper.handle(HandlerWrapper.java:97)
    at wiremock.org.eclipse.jetty.server.Server.handle(Server.java:499)
    at wiremock.org.eclipse.jetty.server.HttpChannel.handle(HttpChannel.java:310)
    at wiremock.org.eclipse.jetty.server.HttpConnection.onFillable(HttpConnection.java:257)
    at wiremock.org.eclipse.jetty.io.AbstractConnection$2.run(AbstractConnection.java:540)
    at wiremock.org.eclipse.jetty.util.thread.QueuedThreadPool.runJob(QueuedThreadPool.java:635)
    at wiremock.org.eclipse.jetty.util.thread.QueuedThreadPool$3.run(QueuedThreadPool.java:555)
    at java.lang.Thread.run(Thread.java:745)
2017-03-02 11:11:51.046 Outgoing bytes:
0


2017-03-02 11:11:51.685 Incoming bytes: GET /pools/default?waitChange=0 HTTP/1.1
Authorization: Basic cm91c2VyOnBhc3N3b3Jk
Accept: */*
User-Agent: insomnia/4.2.14
host: localhost:8442
accept-encoding: gzip, deflate
Connection: keep-alive


2017-03-02 11:11:51.686 Proxying: GET http://<my-couchbase-host>:8091/pools/default?waitChange=0
2017-03-02 11:11:51.689 Outgoing bytes: HTTP/1.1 500 Server Error
Cache-Control: must-revalidate,no-cache,no-store
Content-Type: text/html; charset=ISO-8859-1
Content-Length: 395
Connection: close
Server: Jetty(9.2.z-SNAPSHOT)


2017-03-02 11:11:51.690 Outgoing bytes: <html>
<head>
<meta http-equiv="Content-Type" content="text/html;charset=ISO-8859-1"/>
<title>Error 500 </title>
</head>
<body>
<h2>HTTP ERROR: 500</h2>
<p>Problem accessing /pools/default. Reason:
<pre>    java.lang.RuntimeException: wiremock.org.apache.http.NoHttpResponseException: The target server failed to respond</pre></p>
<hr /><i><small>Powered by Jetty://</small></i>
</body>
</html>

2017-03-02 11:11:51.691 Closed Socket[addr=/127.0.0.1,port=60484,localport=8442]
2017-03-02 11:11:51.692 Closed Socket[addr=/127.0.0.1,port=60484,localport=8442]
```

**Comment by jharrilim** [comment]
I am getting a similar problem as well, except I am trying to use WireMock to proxy a 2-way SSL connection from an Apache server that I'm hosting locally. I wonder if we cannot use charset "UTF-8" in [ConsoleNotifyingWiremockNetworkTrafficListener.java.](https://github.com/tomakehurst/wiremock/blob/70e858da751957f4cdabe03bdff97153dd0d5067/src/main/java/com/github/tomakehurst/wiremock/http/trafficlistener/ConsoleNotifyingWiremockNetworkTrafficListener.java) My server normally sends back a response with _gzip_ content-encoding.

`java -jar wiremock-standalone-2.5.0.jar --port '8093' --https-port '8091' --https-keystore keystores/client.jks --verbose --proxy-all="https://127.0.0.1" --https-truststore keystores/server.jks --record-mappings --https-require-client-cert --truststore-password="password" --print-all-network-traffic`

I have certificates imported into Firefox, and when I hit **https://127.0.0.1:8091/**, I get a similar trace in the console starting with:
`2017-03-02 15:40:57.554 Opened Socket[addr=/127.0.0.1,port=37672,localport=8091]
2017-03-02 15:40:57.627 Problem decoding network traffic
java.nio.charset.MalformedInputException: Input length = 1
	at java.nio.charset.CoderResult.throwException(CoderResult.java:281)
	at java.nio.charset.CharsetDecoder.decode(CharsetDecoder.java:816)
	at com.github.tomakehurst.wiremock.http.trafficlistener.ConsoleNotifyingWiremockNetworkTrafficListener.incoming(ConsoleNotifyingWiremockNetworkTrafficListener.java:25)
	at com.github.tomakehurst.wiremock.jetty9.JettyHttpServer$NetworkTrafficListenerAdapter.incoming(JettyHttpServer.java:345)
	at wiremock.org.eclipse.jetty.io.NetworkTrafficSelectChannelEndPoint.notifyIncoming(NetworkTrafficSelectChannelEndPoint.java:125)
	at wiremock.org.eclipse.jetty.io.NetworkTrafficSelectChannelEndPoint.fill(NetworkTrafficSelectChannelEndPoint.java:48)
	at wiremock.org.eclipse.jetty.io.ssl.SslConnection$DecryptedEndPoint.fill(SslConnection.java:507)
	at wiremock.org.eclipse.jetty.server.HttpConnection.onFillable(HttpConnection.java:239)
	at wiremock.org.eclipse.jetty.io.AbstractConnection$2.run(AbstractConnection.java:540)
	at wiremock.org.eclipse.jetty.util.thread.QueuedThreadPool.runJob(QueuedThreadPool.java:635)
	at wiremock.org.eclipse.jetty.util.thread.QueuedThreadPool$3.run(QueuedThreadPool.java:555)
	at java.lang.Thread.run(Thread.java:745)`

**Comment by Joe-Klauza** [comment]
Sorry @jharrilim, my issue is not the trace in the console. That is simply an issue with outputting the headers to the console (see that this is coming from `ConsoleNotifyingWiremockNetworkTrafficListener`, which is quite literally named. Unless you're experiencing the `Error 500` from Jetty in your response body, please file a separate issue.

**Comment by tomakehurst** [comment]
@wojciechbulaty any idea why this might be happening?

**Comment by jharrilim** [comment]
I was also receiving a 500 as well. I found something out which created a temporary fix. When I set Firefox to prompt me every time for a client certificate, and then I connect to my server (without WireMock), I receive the prompt and I am returned a 200. Right after this, if I connect to my server through WireMock, it works fine.

If I open a new browser and try to connect through WireMock again, I will get the 500, and if I connect to my server without WireMock with "Select One Automatically" chosen and then try again with WireMock, it will also give 500.

**Comment by Joe-Klauza** [comment]
@jharrilim it is possible this is related, but I am not using SSL/TLS in my requests to either WireMock or Couchbase, so I believe this may be a separate issue you are having.

**Comment by Joe-Klauza** [comment]
I've done some more testing. It appears that _any_ secondary call will fail if made immediately after a call to `pools/default?waitChange=0`, even if that `waitChange` call already received a response. I'm starting to suspect that Couchbase has some kind of logic happening behind-the-scenes when `waitChange` is specified with any positive integer value, which affects the response of a second, immediate request when proxied via WireMock.

Why this happens with WireMock but not with direct requests, I'm not sure. [Here](https://github.com/couchbase/ns_server/search?utf8=%E2%9C%93&q=waitChange) are the instances of `waitChange` in what I believe to be the applicable Couchbase repository... Not sure if that will be of any help in diagnosing the issue, as I'm not familiar with Erlang.

**Comment by Joe-Klauza** [comment]
Here are some WireShark recordings I've made, in CSV format:

Two direct requests
```
"No.","Time","Source","Destination","Protocol","Length","Info"
"1001","08:26:45.844849","10.66.2.46","10.77.15.10","TCP","78","61858  >  8091 [SYN] Seq=0 Win=65535 Len=0 MSS=1460 WS=32 TSval=172395807 TSecr=0 SACK_PERM=1"
"1003","08:26:45.850254","10.66.2.46","10.77.15.10","TCP","66","61858  >  8091 [ACK] Seq=1 Ack=1 Win=131584 Len=0 TSval=172395812 TSecr=429851455"
"1004","08:26:45.850632","10.66.2.46","10.77.15.10","HTTP","306","GET /pools/default?waitChange=0 HTTP/1.1 "
"1008","08:26:45.888748","10.66.2.46","10.77.15.10","TCP","66","61858  >  8091 [ACK] Seq=241 Ack=180 Win=131392 Len=0 TSval=172395849 TSecr=429851464"
"1011","08:26:45.888881","10.66.2.46","10.77.15.10","TCP","66","61858  >  8091 [ACK] Seq=241 Ack=2980 Win=129664 Len=0 TSval=172395849 TSecr=429851464"
"1013","08:26:45.888986","10.66.2.46","10.77.15.10","TCP","66","61858  >  8091 [ACK] Seq=241 Ack=5780 Win=126848 Len=0 TSval=172395849 TSecr=429851464"
"1016","08:26:45.889161","10.66.2.46","10.77.15.10","TCP","66","61858  >  8091 [ACK] Seq=241 Ack=6040 Win=126592 Len=0 TSval=172395849 TSecr=429851464"
"1017","08:26:45.889161","10.66.2.46","10.77.15.10","TCP","66","61858  >  8091 [ACK] Seq=241 Ack=6041 Win=126592 Len=0 TSval=172395849 TSecr=429851464"
"1018","08:26:45.891788","10.66.2.46","10.77.15.10","TCP","66","[TCP Window Update] 61858  >  8091 [ACK] Seq=241 Ack=6041 Win=131072 Len=0 TSval=172395852 TSecr=429851464"
"1019","08:26:45.894693","10.66.2.46","10.77.15.10","TCP","66","61858  >  8091 [FIN, ACK] Seq=241 Ack=6041 Win=131072 Len=0 TSval=172395854 TSecr=429851464"
"1050","08:26:47.141537","10.66.2.46","10.77.15.10","TCP","78","61859  >  8091 [SYN] Seq=0 Win=65535 Len=0 MSS=1460 WS=32 TSval=172397093 TSecr=0 SACK_PERM=1"
"1055","08:26:47.147689","10.66.2.46","10.77.15.10","TCP","66","61859  >  8091 [ACK] Seq=1 Ack=1 Win=131584 Len=0 TSval=172397099 TSecr=429851779"
"1056","08:26:47.147931","10.66.2.46","10.77.15.10","HTTP","306","GET /pools/default?waitChange=0 HTTP/1.1 "
"1065","08:26:47.177242","10.66.2.46","10.77.15.10","TCP","66","61859  >  8091 [ACK] Seq=241 Ack=180 Win=131392 Len=0 TSval=172397125 TSecr=429851786"
"1068","08:26:47.177430","10.66.2.46","10.77.15.10","TCP","66","61859  >  8091 [ACK] Seq=241 Ack=2980 Win=128608 Len=0 TSval=172397125 TSecr=429851786"
"1070","08:26:47.177589","10.66.2.46","10.77.15.10","TCP","66","61859  >  8091 [ACK] Seq=241 Ack=5780 Win=125792 Len=0 TSval=172397125 TSecr=429851786"
"1073","08:26:47.177738","10.66.2.46","10.77.15.10","TCP","66","61859  >  8091 [ACK] Seq=241 Ack=6040 Win=125536 Len=0 TSval=172397125 TSecr=429851786"
"1074","08:26:47.177738","10.66.2.46","10.77.15.10","TCP","66","61859  >  8091 [ACK] Seq=241 Ack=6041 Win=125536 Len=0 TSval=172397125 TSecr=429851786"
"1075","08:26:47.178388","10.66.2.46","10.77.15.10","TCP","66","[TCP Window Update] 61859  >  8091 [ACK] Seq=241 Ack=6041 Win=131072 Len=0 TSval=172397126 TSecr=429851786"
"1076","08:26:47.180093","10.66.2.46","10.77.15.10","TCP","66","61859  >  8091 [FIN, ACK] Seq=241 Ack=6041 Win=131072 Len=0 TSval=172397127 TSecr=429851786"
```

Two WireMock-proxied requests
```
"No.","Time","Source","Destination","Protocol","Length","Info"
"97","08:29:49.512391","10.66.2.46","10.77.15.10","TCP","66","61912  >  8091 [FIN, ACK] Seq=1 Ack=1 Win=4096 Len=0 TSval=172578294 TSecr=429895524"
"98","08:29:49.512622","10.66.2.46","10.77.15.10","TCP","78","61914  >  8091 [SYN] Seq=0 Win=65535 Len=0 MSS=1460 WS=32 TSval=172578294 TSecr=0 SACK_PERM=1"
"102","08:29:49.518171","10.66.2.46","10.77.15.10","TCP","66","61914  >  8091 [ACK] Seq=1 Ack=1 Win=131584 Len=0 TSval=172578299 TSecr=429897371"
"103","08:29:49.518390","10.66.2.46","10.77.15.10","HTTP","294","GET /pools/default?waitChange=0 HTTP/1.1 "
"108","08:29:49.563194","10.66.2.46","10.77.15.10","TCP","66","61914  >  8091 [ACK] Seq=229 Ack=180 Win=131392 Len=0 TSval=172578343 TSecr=429897383"
"109","08:29:49.563272","10.66.2.46","10.77.15.10","TCP","66","61914  >  8091 [ACK] Seq=229 Ack=2980 Win=129664 Len=0 TSval=172578343 TSecr=429897383"
"114","08:29:49.563624","10.66.2.46","10.77.15.10","TCP","66","61914  >  8091 [ACK] Seq=229 Ack=4380 Win=131072 Len=0 TSval=172578343 TSecr=429897383"
"115","08:29:49.563647","10.66.2.46","10.77.15.10","TCP","66","61914  >  8091 [ACK] Seq=229 Ack=6041 Win=129408 Len=0 TSval=172578343 TSecr=429897383"
"116","08:29:49.563647","10.66.2.46","10.77.15.10","TCP","66","61914  >  8091 [ACK] Seq=229 Ack=6042 Win=129408 Len=0 TSval=172578343 TSecr=429897383"
"187","08:29:51.036454","10.66.2.46","10.77.15.10","HTTP","294","GET /pools/default?waitChange=0 HTTP/1.1 "
"188","08:29:51.036582","10.66.2.46","10.77.15.10","TCP","66","61914  >  8091 [FIN, ACK] Seq=457 Ack=6042 Win=131072 Len=0 TSval=172579802 TSecr=429897383"
```

**Comment by wojciechbulaty** [comment]
To make this work today, as a workaround, you can remove " --print-all-network-traffic" from the command line when starting Wiremock until this issue gets fixed or we figure out what is the root cause.

I can investigate this further when I get a free moment, unfortunately I did not have time for Wiremock lately. Can anybody else pick this up in the meantime?

Note to self: the java CharsetDecoder cannot parse the response in UTF-8. Also, hardcoding UTF-8 is a dodgy, when the traffic is binary.

**Comment by Joe-Klauza** [comment]
@wojciechbulaty as stated in my [previous comment](https://github.com/tomakehurst/wiremock/issues/620#issuecomment-283968426), the stack trace printed is not at all related to my issue. I can reproduce this reliably with `--print-all-network-traffic` not present as a command line argument. Here is the STDOUT with this flag not present:

```
java -jar /path/to/wiremock-standalone-2.5.1.jar --container-threads 200 --verbose --https-port 8443 --port 8442 --root-dir /path/to/some --proxy-all="http://<my-couchbase-host>:8091" --record-mappings --match-headers="Accept,Content-Type,Cache-Control,Authorization"
2017-03-07 08:11:36.190 Verbose logging enabled
SLF4J: Failed to load class "org.slf4j.impl.StaticLoggerBinder".
SLF4J: Defaulting to no-operation (NOP) logger implementation
SLF4J: See http://www.slf4j.org/codes.html#StaticLoggerBinder for further details.
2017-03-07 08:11:36.471 Verbose logging enabled
2017-03-07 08:11:36.502 Recording mappings to /path/to/some/mappings
 /$$      /$$ /$$                     /$$      /$$                     /$$
| $$  /$ | $$|__/                    | $$$    /$$$                    | $$
| $$ /$$$| $$ /$$  /$$$$$$   /$$$$$$ | $$$$  /$$$$  /$$$$$$   /$$$$$$$| $$   /$$
| $$/$$ $$ $$| $$ /$$__  $$ /$$__  $$| $$ $$/$$ $$ /$$__  $$ /$$_____/| $$  /$$/
| $$$$_  $$$$| $$| $$  \__/| $$$$$$$$| $$  $$$| $$| $$  \ $$| $$      | $$$$$$/
| $$$/ \  $$$| $$| $$      | $$_____/| $$\  $ | $$| $$  | $$| $$      | $$_  $$
| $$/   \  $$| $$| $$      |  $$$$$$$| $$ \/  | $$|  $$$$$$/|  $$$$$$$| $$ \  $$
|__/     \__/|__/|__/       \_______/|__/     |__/ \______/  \_______/|__/  \__/

port:                         8442
https-port:                   8443
https-keystore:               jar:file:/path/to/wiremock-standalone-2.5.1.jar!/keystore
proxy-all:                    http://<my-couchbase-host>:8091
preserve-host-header:         false
enable-browser-proxying:      false
record-mappings:              true
match-headers:                [Accept, Content-Type, Cache-Control, Authorization]
no-request-journal:           false
verbose:                      true

2017-03-07 08:11:42.258 Proxying: GET http://<my-couchbase-host>:8091/pools/default?waitChange=0
2017-03-07 08:11:42.531 Request received:
127.0.0.1 - GET /pools/default?waitChange=0

Connection: [close]
Authorization: [Basic cm91c2VyOnBhc3N3b3Jk]
User-Agent: [insomnia/4.2.14]
Host: [localhost:8442]
Accept-Encoding: [gzip, deflate]
Accept: [*/*]



Matched response definition:
{
  "status" : 200,
  "proxyBaseUrl" : "http://<my-couchbase-host>:8091"
}

Response:
HTTP/1.1 200
Server: [Couchbase Server]
Pragma: [no-cache]
Date: [Tue, 07 Mar 2017 13:11:48 GMT]
Content-Type: [application/json]
Content-Length: [5855]
Cache-Control: [no-cache]

{"etag":"11476611","clusterName":"","storageTotals":{"ram":{"total":12289662976,"quotaTotal":6442450944,"quotaUsed":6442450944,"used":7370633216,"usedByData":603268732,"quotaUsedPerNode":2147483648,"quotaTotalPerNode":2147483648},"hdd":{"total":222675869696,"quotaTotal":222675869696,"used":2226758696,"usedByData":471120397,"free":0}},"balanced":true,"failoverWarnings":[],"goxdcrEnabled":true,"ldapEnabled":false,"serverGroupsUri":"/pools/default/serverGroups?v=108506564","indexMemoryQuota":256,"memoryQuota":2048,"name":"default","alerts":[],"alertsSilenceURL":"/controller/resetAlerts?token=0&uuid=8e989e84e055a831e614fc877e41a325","nodes":[{"systemStats":{"cpu_utilization_rate":25.15151515151515,"swap_total":6442446848,"swap_used":11927552,"mem_total":3975221248,"mem_free":1933709312},"interestingStats":{"cmd_get":0,"couch_docs_actual_disk_size":151499293,"couch_docs_data_size":122352976,"couch_spatial_data_size":5963158,"couch_spatial_disk_size":5974801,"couch_views_actual_disk_size":6020437,"couch_views_data_size":45636,"curr_items":18085,"curr_items_tot":40985,"ep_bg_fetched":0,"get_hits":0,"mem_used":211950176,"ops":0,"vb_replica_curr_items":22900},"uptime":"1797170","memoryTotal":3975221248,"memoryFree":1933709312,"mcdMemoryReserved":3032,"mcdMemoryAllocated":3032,"couchApiBase":"http://10.77.15.9:8092/","clusterMembership":"active","recoveryType":"none","status":"healthy","otpNode":"ns_1@10.77.15.9","hostname":"10.77.15.9:8091","clusterCompatibility":262145,"version":"4.1.1-5914-community","os":"x86_64-unknown-linux-gnu","ports":{"proxy":11211,"direct":11210},"services":["kv"]},{"systemStats":{"cpu_utilization_rate":9.063444108761329,"swap_total":6442446848,"swap_used":16384,"mem_total":4019945472,"mem_free":2051289088},"interestingStats":{"cmd_get":0,"couch_docs_actual_disk_size":145285416,"couch_docs_data_size":115802791,"couch_spatial_data_size":6016449,"couch_spatial_disk_size":6028080,"couch_views_actual_disk_size":6073704,"couch_views_data_size":45624,"curr_items":17971,"curr_items_tot":40872,"ep_bg_fetched":0,"get_hits":0,"mem_used":203331336,"ops":0,"vb_replica_curr_items":22901},"uptime":"60771","memoryTotal":4019945472,"memoryFree":2051289088,"mcdMemoryReserved":3066,"mcdMemoryAllocated":3066,"couchApiBase":"http://<my-couchbase-host>:8092/","clusterMembership":"active","recoveryType":"none","status":"healthy","otpNode":"ns_1@<my-couchbase-host>","thisNode":true,"hostname":"<my-couchbase-host>:8091","clusterCompatibility":262145,"version":"4.1.1-5914-community","os":"x86_64-unknown-linux-gnu","ports":{"proxy":11211,"direct":11210},"services":["index","kv","n1ql"]},{"systemStats":{"cpu_utilization_rate":10.48141377209019,"swap_total":5032693760,"swap_used":3154784256,"mem_total":4294496256,"mem_free":1694707712},"interestingStats":{"cmd_get":0,"couch_docs_actual_disk_size":138153328,"couch_docs_data_size":107413823,"couch_spatial_data_size":6007194,"couch_spatial_disk_size":6019831,"couch_views_actual_disk_size":6065507,"couch_views_data_size":45676,"curr_items":18010,"curr_items_tot":40877,"ep_bg_fetched":0,"get_hits":0,"mem_used":187987220,"ops":0,"vb_replica_curr_items":22869},"uptime":"1796863","memoryTotal":4294496256,"memoryFree":1694707712,"mcdMemoryReserved":3276,"mcdMemoryAllocated":3276,"couchApiBase":"http://<another-couchbase-host>:8092/","clusterMembership":"active","recoveryType":"none","status":"healthy","otpNode":"ns_1@<another-couchbase-host>","hostname":"<another-couchbase-host>:8091","clusterCompatibility":262145,"version":"4.1.1-5914-community","os":"win64","ports":{"proxy":11211,"direct":11210},"services":["index","kv","n1ql"]}],"buckets":{"uri":"/pools/default/buckets?v=80956094&uuid=8e989e84e055a831e614fc877e41a325","terseBucketsBase":"/pools/default/b/","terseStreamingBucketsBase":"/pools/default/bs/"},"remoteClusters":{"uri":"/pools/default/remoteClusters?uuid=8e989e84e055a831e614fc877e41a325","validateURI":"/pools/default/remoteClusters?just_validate=1"},"controllers":{"addNode":{"uri":"/controller/addNodeV2?uuid=8e989e84e055a831e614fc877e41a325"},"rebalance":{"uri":"/controller/rebalance?uuid=8e989e84e055a831e614fc877e41a325"},"failOver":{"uri":"/controller/failOver?uuid=8e989e84e055a831e614fc877e41a325"},"startGracefulFailover":{"uri":"/controller/startGracefulFailover?uuid=8e989e84e055a831e614fc877e41a325"},"reAddNode":{"uri":"/controller/reAddNode?uuid=8e989e84e055a831e614fc877e41a325"},"reFailOver":{"uri":"/controller/reFailOver?uuid=8e989e84e055a831e614fc877e41a325"},"ejectNode":{"uri":"/controller/ejectNode?uuid=8e989e84e055a831e614fc877e41a325"},"setRecoveryType":{"uri":"/controller/setRecoveryType?uuid=8e989e84e055a831e614fc877e41a325"},"setAutoCompaction":{"uri":"/controller/setAutoCompaction?uuid=8e989e84e055a831e614fc877e41a325","validateURI":"/controller/setAutoCompaction?just_validate=1"},"clusterLogsCollection":{"startURI":"/controller/startLogsCollection?uuid=8e989e84e055a831e614fc877e41a325","cancelURI":"/controller/cancelLogsCollection?uuid=8e989e84e055a831e614fc877e41a325"},"replication":{"createURI":"/controller/createReplication?uuid=8e989e84e055a831e614fc877e41a325","validateURI":"/controller/createReplication?just_validate=1"}},"rebalanceStatus":"none","rebalanceProgressUri":"/pools/default/rebalanceProgress","stopRebalanceUri":"/controller/stopRebalance?uuid=8e989e84e055a831e614fc877e41a325","nodeStatusesUri":"/nodeStatuses","maxBucketCount":10,"autoCompactionSettings":{"parallelDBAndViewCompaction":false,"databaseFragmentationThreshold":{"percentage":30,"size":"undefined"},"viewFragmentationThreshold":{"percentage":30,"size":"undefined"},"indexFragmentationThreshold":{"percentage":30}},"tasks":{"uri":"/pools/default/tasks?v=39150923"},"counters":{"rebalance_success":1,"rebalance_start":1},"indexStatusURI":"/indexStatus?v=101727310"}

2017-03-07 08:11:42.533 Recording mappings for /pools/default?waitChange=0
2017-03-07 08:11:43.286 Proxying: GET http://<my-couchbase-host>:8091/settings/autoFailover
```

Here is a screenshot of Insomnia's received response from WireMock/Jetty after the second request:

![image](https://cloud.githubusercontent.com/assets/13367199/23657933/8661c94a-030e-11e7-99bc-0fbf7f22e78c.png)

**Comment by Joe-Klauza** [comment]
Here is the same in [Postman](https://www.getpostman.com/), just to support that Insomnia is not affecting the result:

![image](https://cloud.githubusercontent.com/assets/13367199/23659337/d0f63ae0-0313-11e7-803a-344ea4e70fb3.png)

Again, the procedure for this test was:

- `GET /pools/default?waitChange=0`
- `GET /settings/autoFailover`

**Comment by kagan94** [comment]
In my case, we received error "Problem decoding network traffic java.nio.charset.MalformedInputException: Input length = 1" because of GZIP compression that resulted into malformed response on latest WireMock image.

The fix was to disable GZIP compression by adding following parameter to WIREMOCK_OPTIONS:  
```
--disable-gzip
```
