### ISSUE TITLE
Request matching near miss with header Accept-Encoding

### ISSUE THREAD

**Issue by christopheml** [tomakehurst/wiremock#724]
WireMock version : 2.6.0, JUnit rule.

I'm currently testing a feature in a client application where support for gzip encoding in the response can be switched on or off with a configuration flag. If the flag is enabled, the client sets the Accept-Encoding header to gzip. If the flag is disabled, no Accept-Encoding header is sent.

When I want to test the latter behavior by verifying that the Accept-Encoding header is absent, the test fails stating that the Accept-Encoding header is indeed present and set to "gzip,deflate". Upon closer examination through debugging, the underlying client HTTP library makes the request without the header, but when WireMock reconstructs the request for matching purposes, the header is present.

Here's the body of the test
```java
        stubFor(post("/path/to/resource")
                .willReturn(aResponse()
                        .withStatus(200)
                        .withHeader("Content-Type", "text/xml")
                        .withBodyFile("response.xml")));

       // client making the request

        verify(postRequestedFor(urlEqualTo("/path/to/resource"))
                .withHeader("Accept-Encoding", absent()))
```

Here's the output 

```
No requests exactly matched. Most similar request was:  expected:<
POST
/path/to/resource
Accept-Encoding: null
> but was:<
POST
/path/to/resource
Accept-Encoding: gzip,deflate
>
```

I haven't found out if the behavior is coming from WireMock or the underlying jetty, but it prevents this simple test from working properly.

**Comment by tomakehurst** [comment]
Could you post the full test case that replicates this?

**Comment by christopheml** [comment]
I'm going to have to work a little bit on this, there's some corporate code around that I can't share so I'll try to post the minimal project reproducing the issue.

**Comment by christopheml** [comment]
Hello @tomakehurst, a sample project reproducing the issue is available here : https://github.com/christopheml/wiremockheaderbug

**Comment by tomakehurst** [comment]
Great, thank you.

**Comment by tomakehurst** [comment]
I ran your test with tcpdump enabled and it looks like your client is sending the `Accept-Encoding` header:

```
19:17:44.268883 IP localhost.64901 > localhost.8085: Flags [P.], seq 1:158, ack 1, win 12759, options [nop,nop,TS val 608001468 ecr 608001468], length 157
E....}@.@...................X{.m..1........
$=].$=].GET /homepage HTTP/1.1
Host: localhost:8085
Connection: Keep-Alive
User-Agent: Apache-HttpClient/4.5.3 (Java/1.8.0_121)
Accept-Encoding: gzip,deflate


19:17:44.268898 IP localhost.8085 > localhost.64901: Flags [.], ack 158, win 12754, options [nop,nop,TS val 608001468 ecr 608001468], length 0
E..4..@.@...............X{.m...<..1..(.....
$=].$=].
19:17:44.277740 IP localhost.8085 > localhost.64901: Flags [P.], seq 1:143, ack 158, win 12754, options [nop,nop,TS val 608001476 ecr 608001468], length 142
E....0@.@...............X{.m...<..1........
$=].$=].HTTP/1.1 200 OK
Content-Encoding: gzip
Vary: Accept-Encoding, User-Agent
Transfer-Encoding: chunked
Server: Jetty(9.2.13.v20150730)

A

```

**Comment by christopheml** [comment]
I dug deeper through Apache HttpClient and there's indeed some part of it that is adding default headers when they're absent (`org.apache.http.client.protocol.RequestAcceptEncoding`) and this is an oversight on my part.

So definitely not a WireMock bug, sorry I've wasted some time of yours with this.
Please know that your work on WireMock is really appreciated and makes our programmer lives where I work a ton better. Thank you.

**Comment by tomakehurst** [comment]
Thanks, no worries!
